{
  "schemaVersion": 2,
  "id": "dog-skull-ventral",
  "title": "Canine skull — ventral view",
  "orientation": "ventral",
  "image": {
    "type": "dzi",
    "src": "tiles/dog-skull-ventral/dog-skull-ventral.dzi",
    "fallback": "images/ventral.jpg",
    "thumbnail": "images/thumbnails/views/dog-skull-ventral.webp",
    "width": 6000,
    "height": 4000,
    "alt": "Ventral view of a canine skull"
  },
  "labels": [
    {
      "id": "foramen-magnum-ventral",
      "name": "Agujero Magno",
      "description": "El agujero magno...",
      "position": {
        "x": 0.145,
        "y": 0.33
      },
      "category": "foramen",
      "status": "published",
      "quiz": {
        "eligible": true,
        "difficulty": "intermediate",
        "acceptedRadius": 0.035
      },
      "translations": {
        "es": {
          "name": "Agujero Magno",
          "description": "El agujero magno...",
          "aliases": [
            "Agujero Magno"
          ]
        },
        "en": {
          "name": "Foramen magnum",
          "description": "The foramen magnum...",
          "aliases": [
            "foramen magnum"
          ]
        }
      },
      "terminology": {
        "latin": "Foramen magnum"
      }
    }
  ],
  "status": "published",
  "translations": {
    "es": {
      "title": "Cráneo canino — vista ventral"
    },
    "en": {
      "title": "Canine skull — ventral view"
    }
  }
}
