{
  "schemaVersion": 2,
  "id": "dog-skull-lateral",
  "title": "Canine skull — lateral view",
  "orientation": "lateral",
  "image": {
    "type": "dzi",
    "src": "tiles/dog-skull-lateral/dog-skull-lateral.dzi",
    "fallback": "images/lateral.jpg",
    "thumbnail": "images/thumbnails/views/dog-skull-lateral.webp",
    "width": 6000,
    "height": 4000,
    "alt": "Lateral view of a canine skull"
  },
  "labels": [
    {
      "id": "zygomatic-arch",
      "name": "Arco Cigomático",
      "description": "Descripción anatómica pendiente.",
      "position": {
        "x": 0.395,
        "y": 0.315
      },
      "category": "bone-landmark",
      "status": "published",
      "quiz": {
        "eligible": true,
        "difficulty": "beginner",
        "acceptedRadius": 0.055
      },
      "translations": {
        "es": {
          "name": "Arco Cigomático",
          "description": "Descripción anatómica pendiente.",
          "aliases": [
            "Arco Cigomático"
          ]
        },
        "en": {
          "name": "Zygomatic arch",
          "description": "Anatomical description pending.",
          "aliases": [
            "zygomatic arch"
          ]
        }
      }
    },
    {
      "id": "infraorbital-foramen",
      "name": "Agujero Infraorbitario",
      "description": "El agujero infraorbitario...",
      "position": {
        "x": 0.655,
        "y": 0.36
      },
      "category": "foramen",
      "status": "published",
      "quiz": {
        "eligible": true,
        "difficulty": "intermediate",
        "acceptedRadius": 0.035
      },
      "translations": {
        "es": {
          "name": "Agujero Infraorbitario",
          "description": "El agujero infraorbitario...",
          "aliases": [
            "Agujero Infraorbitario",
            "Foramen infraorbitario"
          ]
        },
        "en": {
          "name": "Infraorbital foramen",
          "description": "The infraorbital foramen...",
          "aliases": [
            "infraorbital foramen",
            "infraorbital opening"
          ]
        }
      },
      "terminology": {
        "latin": "Foramen infraorbitale"
      }
    },
    {
      "id": "zygomatic-process",
      "name": "Proceso Cigomático",
      "description": "El Proceso Cigomático...",
      "position": {
        "x": 0.275,
        "y": 0.36
      },
      "category": "process",
      "status": "published",
      "quiz": {
        "eligible": true,
        "difficulty": "intermediate",
        "acceptedRadius": 0.045
      },
      "translations": {
        "es": {
          "name": "Proceso Cigomático",
          "description": "El Proceso Cigomático...",
          "aliases": [
            "Proceso Cigomático"
          ]
        },
        "en": {
          "name": "Zygomatic process",
          "description": "The zygomatic process...",
          "aliases": [
            "zygomatic process"
          ]
        }
      }
    },
    {
      "id": "zygomatic-bone",
      "name": "Hueso Cigomático",
      "description": "El Hueso Cigomático...",
      "position": {
        "x": 0.455,
        "y": 0.335
      },
      "category": "bone",
      "status": "published",
      "quiz": {
        "eligible": true,
        "difficulty": "beginner",
        "acceptedRadius": 0.065
      },
      "translations": {
        "es": {
          "name": "Hueso Cigomático",
          "description": "El Hueso Cigomático...",
          "aliases": [
            "Hueso Cigomático"
          ]
        },
        "en": {
          "name": "Zygomatic bone",
          "description": "The zygomatic bone...",
          "aliases": [
            "zygomatic bone",
            "malar bone"
          ]
        }
      },
      "terminology": {
        "latin": "Os zygomaticum"
      }
    },
    {
      "id": "temporozygomatic-fissure",
      "name": "Fisura Temporocigomática",
      "description": "La Fisura Temporocigomática...",
      "position": {
        "x": 0.322,
        "y": 0.335
      },
      "category": "bone-landmark",
      "status": "published",
      "quiz": {
        "eligible": true,
        "difficulty": "advanced",
        "acceptedRadius": 0.04
      },
      "translations": {
        "es": {
          "name": "Fisura Temporocigomática",
          "description": "La Fisura Temporocigomática...",
          "aliases": [
            "Fisura Temporocigomática"
          ]
        },
        "en": {
          "name": "Temporozygomatic fissure",
          "description": "The temporozygomatic fissure...",
          "aliases": [
            "temporozygomatic fissure"
          ]
        }
      }
    },
    {
      "id": "parietal-bone",
      "name": "Hueso Parietal",
      "description": "El Hueso Parietal...",
      "position": {
        "x": 0.165,
        "y": 0.285
      },
      "category": "bone",
      "status": "published",
      "quiz": {
        "eligible": true,
        "difficulty": "beginner",
        "acceptedRadius": 0.065
      },
      "translations": {
        "es": {
          "name": "Hueso Parietal",
          "description": "El Hueso Parietal...",
          "aliases": [
            "Hueso Parietal"
          ]
        },
        "en": {
          "name": "Parietal bone",
          "description": "The parietal bone...",
          "aliases": [
            "parietal bone"
          ]
        }
      },
      "terminology": {
        "latin": "Os parietale"
      }
    },
    {
      "id": "squamous-suture",
      "name": "Sutura Escamosa",
      "description": "La Sutura Escamosa...",
      "position": {
        "x": 0.197,
        "y": 0.305
      },
      "category": "suture",
      "status": "published",
      "quiz": {
        "eligible": true,
        "difficulty": "advanced",
        "acceptedRadius": 0.045
      },
      "translations": {
        "es": {
          "name": "Sutura Escamosa",
          "description": "La Sutura Escamosa...",
          "aliases": [
            "Sutura Escamosa"
          ]
        },
        "en": {
          "name": "Squamous suture",
          "description": "The squamous suture...",
          "aliases": [
            "squamous suture",
            "squamosal suture"
          ]
        }
      }
    },
    {
      "id": "coronal-suture",
      "name": "Sutura Coronal",
      "description": "La Sutura Coronal...",
      "position": {
        "x": 0.261,
        "y": 0.227
      },
      "category": "suture",
      "status": "published",
      "quiz": {
        "eligible": true,
        "difficulty": "advanced",
        "acceptedRadius": 0.045
      },
      "translations": {
        "es": {
          "name": "Sutura Coronal",
          "description": "La Sutura Coronal...",
          "aliases": [
            "Sutura Coronal"
          ]
        },
        "en": {
          "name": "Coronal suture",
          "description": "The coronal suture...",
          "aliases": [
            "coronal suture"
          ]
        }
      }
    }
  ],
  "status": "published",
  "translations": {
    "es": {
      "title": "Cráneo canino — vista lateral"
    },
    "en": {
      "title": "Canine skull — lateral view"
    }
  }
}
